scenario_a,scenario_b,virtue,source
"You pay the laborers the wage you promised, even though a surplus of desperate workers means you could renegotiate for far less and no one would blame you.","You renegotiate the wage downward — the market has shifted in your favor, every other landowner is paying less, your steward says you would be foolish not to, and the laborers have no alternative.",justice,"Aquinas, ST II-II Q.61 a.1"
"You sentence the nobleman to the same penalty as the commoner, knowing the nobleman's family will become your lifelong enemy and may use their influence to end your career.","You give the nobleman a lighter sentence — his family's goodwill is invaluable, the commoner's family has no power to object, the nobleman has already suffered the humiliation of trial, and a pragmatic judge survives longer than a rigid one.",justice,"Aquinas, ST II-II Q.63 a.1"
"You levy taxes proportionally so the wealthy bear more, even though the wealthiest citizens fund your campaigns and have threatened to withdraw their support.","You levy a flat tax — it is simpler to administer, treats everyone equally on paper, the wealthy citizens who fund your government approve, and the poor are accustomed to hardship.",justice,"Ambrose, De Nabuthe 1"
"You return the surplus goods to the supplier, losing items worth a month's income that arrived through no fault of your own.","You keep the surplus — the supplier's carelessness is not your problem, your warehouse is already stocked, reporting the error creates paperwork and delays, and the supplier is a large company that will never notice.",justice,"Aquinas, ST II-II Q.62 a.1"
"You divide your estate equally among all your children, angering your eldest son who expected the customary larger share and whose support you need in your declining years.","You give the eldest the traditional larger share — custom supports it, he will manage the estate and needs resources to do so, the younger children can make their own way, and your eldest will care for you in old age.",justice,"Ambrose, De Officiis I.28"
"You ensure conquered peoples retain their property rights and fair laws, even though your soldiers expect plunder and your generals warn that generosity toward the defeated breeds future rebellion.","You strip the conquered of their property — your soldiers fought for this reward, the treasury needs replenishment, the defeated must learn the cost of resistance, and every successful empire has enriched itself through conquest.",justice,"Augustine, City of God XIX.15"
"You free the slave as the covenant requires when his term expires, losing your most skilled and productive worker.","You find a legal technicality to extend the servitude — this worker is irreplaceable, training a replacement will take years, the technicality is legitimate, and the worker himself seems content enough to continue.",justice,"Ambrose, De Officiis I.28"
"You melt down sacred vessels to ransom captives, knowing the congregation will be furious and your rivals will accuse you of destroying the church's patrimony.","You preserve the sacred vessels — they have been consecrated to God, the captives' families should raise the ransom themselves, the congregation donated these specifically for the church, and your successor will inherit an impoverished institution.",justice,"Ambrose, De Officiis II.28"
"You extend the debtor's repayment period without increasing the debt, absorbing the financial loss yourself.","You demand immediate full repayment — a contract is a contract, the fire was not your fault, showing leniency encourages others to default, and your own creditors will not extend the same mercy to you.",justice,"Ambrose, De Nabuthe 5"
"You distribute captured supplies equally, including to the wounded who could not fight, even though your able-bodied soldiers resent sharing with those who did not risk their lives in the battle.","You distribute only to those who fought — they earned it, the wounded are already receiving medical care, rewarding those who did not fight discourages bravery, and your best soldiers are threatening to desert if they see their share reduced.",justice,"Aquinas, ST II-II Q.61 a.2"
"You grant citizenship to immigrants who have lived peacefully and contributed for years, even though native citizens protest that newcomers are taking jobs and diluting the culture.","You deny citizenship permanently — the native citizens elected you, their concerns about jobs and culture are legitimate, the immigrants can remain as guests, and opening citizenship creates an incentive for more to come.",justice,"Augustine, City of God XIX.17"
"You resolve the boundary dispute by surveying the land and applying the deed, even though the process is expensive and the losing party happens to be your ally.","You award the land to the party who offers you a private gift of gratitude — both claims are roughly equal, someone has to lose, your ally has other lands, and the gift will fund improvements the whole community benefits from.",justice,"Aquinas, ST II-II Q.63 a.1"
"You hear the widow's case with full attention, even though she has no advocate, no documentation, and her case will take hours that could be spent on the docket of paying litigants.","You hear her briefly and move on — your docket is full, the paying litigants fund the court's operations, the widow's case is probably hopeless without documentation, and spending hours on a single indigent case is not how courts survive.",justice,"Ambrose, De Nabuthe 1"
"You subject your own son to the same legal process for theft, even though the public scandal will damage your dynasty and your son may never forgive you.","You handle the matter privately — your son has learned his lesson, public prosecution would destroy the family's reputation for a minor offense, the victim can be quietly compensated, and every great family manages these things discreetly.",justice,"Augustine, City of God V.18"
"You pay the journeyman the full fair value of his work, even though he would accept less and the difference comes directly from your own profit.","You pay the lower amount the journeyman accepts — you offered, he accepted, that is how markets work. Paying more than he asks undermines the entire system of negotiation and makes you look foolish to your peers.",justice,"Aquinas, ST II-II Q.77 a.1"
"You pool community resources for a shared well with contributions proportional to means, even though the wealthiest families object to subsidizing others.","You let the wealthy family build a private well and charge for access — they took the initiative, they bear the cost, the water is cleaner than the stream, and a market for water incentivizes further investment in infrastructure.",justice,"Ambrose, De Nabuthe 3"
"You assign yourself the hardest manual labor, even though your position entitles you to delegate and the work leaves you too exhausted for your administrative duties.","You assign the hard labor to the youngest members — they have the most energy, the hierarchy exists for a reason, your administrative duties require your full attention, and physical labor builds character in the young.",justice,"Aquinas, ST II-II Q.63 a.2"
"You spend extra time with struggling students, even though the gifted students deserve enrichment, their parents donate more, and administrators measure you on the achievements of your best pupils.","You focus on the gifted students — they will go furthest, their success reflects best on your school, their families fund scholarships, and struggling students have many available remedial resources.",justice,"Augustine, De Catechizandis Rudibus 15"
"You sell at the same fair price to the desperate buyer, losing the higher profit you could easily extract.","You raise the price for the desperate buyer — the market sets prices based on demand, his urgency is not your fault, every merchant charges what the market bears, and the extra profit feeds your own family.",justice,"Aquinas, ST II-II Q.77 a.1"
"You pardon former opponents and restore their confiscated property, even though your supporters who fought for you expect those properties as reward.","You keep the confiscated property and distribute it to your supporters — they earned it with their blood, generosity to enemies insults those who sacrificed for you, and weakening former opponents prevents future rebellion.",justice,"Augustine, City of God V.19"
"You correct the underpayment error and pay the difference, even though the worker never noticed and the correction requires explaining the mistake to your accountant.","You keep silent — the error was small, the worker is satisfied with his pay, correcting it creates paperwork, your accountant will question your bookkeeping, and the worker will wonder what else you might have gotten wrong.",justice,"Aquinas, ST II-II Q.62 a.1"
"You discipline each child individually based on their nature and the severity of the offense, which requires deep knowledge of each child and invites accusations of inconsistency.","You apply identical punishments for every offense — it is transparently fair, no child can claim favoritism, the rules are simple and consistent, and individual judgment introduces bias you cannot fully control.",justice,"Aquinas, ST II-II Q.63 a.4"
"You maintain the public granary even though wealthy citizens want the funds redirected to civic monuments that would bear their names.","You redirect the funds to civic monuments — the wealthy donors will increase their contributions, the monuments attract trade and prestige, the poor have survived lean years before, and visible improvements benefit everyone's property values.",justice,"Ambrose, De Nabuthe 7"
"You refuse the bribe and rule according to the evidence, knowing the powerful family will make your life miserable and may have you removed from the bench.","You accept the bribe — the evidence is ambiguous enough to justify either ruling, the family will become a powerful ally, the money solves your own financial troubles, and judges who antagonize the powerful do not remain judges.",justice,"Aquinas, ST II-II Q.63 a.1"
"You reduce rents for your struggling tenants during your own abundant year, directly reducing your income.","You raise rents — the land's value has increased, you have improvement costs to cover, your own prosperity reflects good management that tenants benefit from, and the market rate is the fair rate.",justice,"Ambrose, De Nabuthe 5"
"You treat the gravely ill poor patient before the wealthy patient with a minor ailment, even though the wealthy patient pays generously and is loudly complaining about the wait.","You see the wealthy patient first — he funds the clinic that treats everyone, his continued patronage enables you to see poor patients for free, his time is genuinely more valuable, and a brief consultation will satisfy him quickly.",justice,"Ambrose, De Officiis I.28"
"You divide the inheritance fairly, compensating those who received less during your lifetime, even though your favorite child will be hurt and may distance themselves from you.","You give more to your favorite — she has always been the most devoted, the others made their own choices, parental love is not required to be mathematically equal, and you earned the right to distribute your own wealth as you see fit.",justice,"Aquinas, ST II-II Q.63 a.2"
"You require the senator's villa to meet the same building codes as the tradesman's shop, even though the senator is your patron and has always protected your position.","You grant the senator an exemption — his villa is well-built regardless, enforcing the code against him jeopardizes your position, the tradesman's shop actually needs inspection, and powerful friends are the foundation of a successful career.",justice,"Aquinas, ST II-II Q.63 a.1"
"You share your surplus harvest with starving neighboring villages, even though your own monks must eat more frugally and some resent the sacrifice.","You keep the surplus — your monks worked for it, your first duty is to your community, charity begins at home, the neighboring villages should have planned better, and next year your own harvest might fail.",justice,"Ambrose, De Nabuthe 1"
"You manage the orphan's inheritance faithfully, resisting opportunities to invest portions in your own ventures that would benefit you while technically maintaining the principal.","You invest some of the orphan's funds in your own ventures — the returns will be higher than safe investments, the child benefits from the growth, you benefit from the capital, and as long as the principal is maintained, no harm is done.",justice,"Aquinas, ST II-II Q.62 a.5"
"You remit debts from plague-devastated villages, absorbing a significant loss to the royal treasury.","You demand payment — the treasury has obligations, other regions paid their debts through harder times, forgiveness encourages default, and the villages can sell assets or labor to cover what they owe.",justice,"Ambrose, De Nabuthe 5"
"You disclose your prior relationship with one party and offer to step aside, even though both parties chose you and finding another arbitrator will delay resolution by months.","You proceed without disclosing — your prior relationship will not affect your judgment, you are confident in your impartiality, disclosure will only create unnecessary doubt, and stepping aside wastes everyone's time.",justice,"Aquinas, ST II-II Q.63 a.1"
"You maintain the tenants' dwellings as the lease requires, even though every repair cuts directly into your profits.","You defer maintenance — the tenants have not complained yet, the repairs can wait until next year, your cash flow is tight, and tenants who wanted better housing should have negotiated a different lease.",justice,"Aquinas, ST II-II Q.61 a.3"
"You give wounded soldiers the same rations as those who fought, even though your supply officer warns that full rations for non-combatants will shorten the army's provisions.","You reduce wounded soldiers' rations — they need less food while recovering, the fighting men need full strength, military logic demands prioritizing combat effectiveness, and the wounded will understand.",justice,"Aquinas, ST II-II Q.61 a.2"
"You speak publicly against the wealthy patron's fraud, knowing he will withdraw cathedral funding and your building project will stall for years.","You remain silent — the patron's donations built this cathedral, his fraud is a matter for the civil courts not the church, speaking out will harm your congregation more than the patron, and the workers he defrauded can seek their own remedy.",justice,"Ambrose, De Nabuthe 1"
"You order restitution and punishment for the corrupt tax collectors, even though they are your appointees and their exposure embarrasses your administration.","You take a share of the excess and order more discretion — the revenue still reaches the treasury, punishing your own appointees makes your administration look incompetent, and some overage is inevitable in tax collection.",justice,"Augustine, City of God XIX.15"
"You award compensation to the farmer despite the nobleman's furious protests, knowing the nobleman may take revenge on both you and the farmer.","You dismiss the claim — the nobleman's hunting rights are ancient, the farmer should have fenced his crops, challenging the nobility destabilizes the social order, and the farmer's loss is minor compared to the chaos that challenging a nobleman invites.",justice,"Aquinas, ST II-II Q.62 a.1"
"You evaluate all students by the same standard, even though the patron's child fails and the patron threatens to withdraw funding that supports the entire school.","You give the patron's child a passing grade — the child is close enough, the funding supports dozens of other students, one grade adjustment harms no one, and losing the patron's support would be a far greater injustice to the school.",justice,"Aquinas, ST II-II Q.63 a.1"
"You honor the serfs' earned freedom despite the loss of their labor, which will strain your estate during the busiest season.","You find legal technicalities to keep them — the estate cannot function without their labor, the harvest is weeks away, the law is ambiguous enough to justify delay, and freeing them now would impoverish the tenants who remain.",justice,"Ambrose, De Officiis I.28"
"You admit the skilled foreign craftsman to the guild despite protests from local members who fear the competition.","You reject the foreigner — your members elected you to protect their interests, foreign competition drives down wages, the guild's purpose is to serve its current members, and the craftsman can work outside the guild.",justice,"Augustine, City of God XIX.17"
"You distribute land to settlers according to family size and need, even though your political allies expected the best parcels as reward for their support.","You give the best land to your allies — they made this colony possible, rewarding loyalty ensures continued support, the settlers will be grateful for any land, and allies who feel cheated are more dangerous than settlers who feel slighted.",justice,"Aquinas, ST II-II Q.61 a.2"
"You give elderly and infirm monks extra provisions and lighter duties, even though younger monks complain the elderly are not contributing their fair share.","You hold everyone to the same standard — exceptions breed resentment, the elderly managed these duties when they were young, lighter duties for some means heavier duties for others, and equality is the simplest form of fairness.",justice,"Aquinas, ST II-II Q.63 a.4"
"You appoint a public advocate for the widow's son at public expense, even though the treasury is strained and the boy's guilt seems obvious.","You convict without trial — the evidence is clear, a defense will only delay the inevitable, public funds should not be wasted on an obvious case, and the victim's family deserves swift resolution.",justice,"Ambrose, De Officiis I.24"
"You forbid looting and punish violators, even though your soldiers are furious, morale drops, and your officers warn of mutiny.","You allow limited looting — your soldiers earned this victory, the custom of war permits it, forbidding it risks mutiny, and troops who feel rewarded fight harder in the next battle.",justice,"Augustine, City of God I.7"
"You reduce your own household expenditures during the famine, living austerely while visiting dignitaries note the simplicity of your court.","You maintain your household's standards — the dignity of the crown requires it, austerity at the top signals panic, visiting dignitaries judge the kingdom by its court, and your own reduced consumption would not meaningfully increase the grain supply.",justice,"Ambrose, De Nabuthe 7"
"You record the contract exactly as agreed, even though the more powerful party pressures you and threatens to take his business to another notary.","You alter the terms as the powerful party requests — he is your best client, the weaker party probably will not read the contract carefully, the changes are minor, and losing this client would devastate your practice.",justice,"Aquinas, ST II-II Q.62 a.1"
"You distribute charitable donations to all in need including outsiders, even though your own congregants complain that charity should start at home.","You reserve donations for your own congregation — they contributed the funds, they expect to be prioritized, outsiders have their own communities, and serving your own flock first is not selfishness but stewardship.",justice,"Ambrose, De Officiis I.30"
"You use fraud fines to compensate the defrauded buyers, even though the treasury could use the revenue for popular public projects.","You keep the fines for the treasury — compensating individuals is the civil courts' job, the treasury funds public goods that benefit everyone including fraud victims, and popular projects funded by fines build goodwill for your administration.",justice,"Aquinas, ST II-II Q.62 a.1"
"You listen to both sons separately and mediate fairly, even though the process takes days and your elder son accuses you of undermining his authority as firstborn.","You side with the elder — tradition supports his precedence, quick resolution restores family peace, the younger son needs to learn respect for hierarchy, and your elder son's loyalty is more practically important.",justice,"Augustine, Confessions IX.9"
"You suspend rent for the sick tenant until he recovers, absorbing months of lost income.","You evict the family — other tenants are waiting, you have mortgage payments of your own, illness is not your responsibility, and one act of charity for one tenant is an injustice to your own family.",justice,"Ambrose, De Nabuthe 5"
"You give shares to the camp followers who cooked and tended the wounded, even though the warriors protest that those who did not fight should not share in the spoils.","You give shares only to those who fought — they risked their lives, the camp followers knew the terms of their service, rewarding non-combatants devalues the warriors' sacrifice, and your best fighters are the ones you need to keep happy.",justice,"Aquinas, ST II-II Q.61 a.2"
"You ensure roads in poor districts receive equal maintenance, even though wealthy districts generate the tax revenue and their influential residents expect priority.","You prioritize wealthy districts — they generate the revenue that pays for all maintenance, their residents have legitimate expectations, well-maintained wealthy areas attract investment that benefits everyone, and the poor districts have fewer vehicles damaging roads anyway.",justice,"Aquinas, ST II-II Q.61 a.2"
"You seek out yesterday's buyer to offer a refund for the defective goods, losing the sale and spending time on a problem you could simply ignore.","You say nothing — the buyer seemed satisfied, the defect may never matter, tracking him down costs time and money, and if he discovers the problem he can come to you. Most buyers never return.",justice,"Aquinas, ST II-II Q.77 a.1"
"You appoint judges based on legal knowledge and fairness, even though politically loyal judges would protect your interests in the inevitable legal challenges to your reign.","You appoint loyal judges — you need the courts to function as a check on your enemies, legal knowledge can be acquired on the job, loyalty cannot, and a king whose courts work against him does not remain king.",justice,"Augustine, City of God V.19"
"You compel the brother to make restitution and apologize publicly, even though the scandal will damage the monastery's reputation and donations may decline.","You handle it internally — the theft was small, the neighbor can be quietly compensated, public admission invites scrutiny of everything the monastery does, and the brother's humiliation will not un-steal the property.",justice,"Aquinas, ST II-II Q.62 a.1"
"You allocate equal time to each petitioner regardless of rank, even though the nobles control the council's agenda and are visibly irritated at waiting behind peasants.","You hear the nobles first and at length — they bring matters of policy that affect everyone, their time is genuinely more valuable, peasant grievances are usually simple and quick, and keeping the nobles happy keeps the council functioning.",justice,"Aquinas, ST II-II Q.63 a.1"
"You invest in proper ventilation and safety equipment, even though the expense cuts deeply into your margins and your competitors who skip these costs undercut your prices.","You cut safety costs — your workers have not complained, the regulations are rarely enforced, your competitors operate the same way, and the savings let you keep prices competitive and your workers employed.",justice,"Aquinas, ST II-II Q.61 a.3"
"You voluntarily surrender power when the king comes of age, returning to your previous modest station.","You find reasons to delay the transfer — the king is technically of age but clearly not ready, the kingdom's stability depends on experienced governance, your allies hold key positions that will be reshuffled, and a few more years of your stewardship benefits everyone.",justice,"Augustine, City of God V.19"
"You build fountains in poor quarters as well as rich, even though the wealthy taxpayers who fund infrastructure object to their money being spent in districts they never visit.","You build fountains in wealthy neighborhoods first — the taxpayers who fund them deserve to benefit, the infrastructure will eventually expand, and building where property values are higher generates more return on investment.",justice,"Ambrose, De Nabuthe 3"
"You advocate for the unpopular prisoner you believe was wrongly convicted, even though the community considers the prisoner guilty and your advocacy makes you a pariah.","You stay silent — the court has spoken, the prisoner is universally despised, your reputation is your most valuable tool for helping others, and spending it on one unpopular case means you cannot help the many who need you.",justice,"Ambrose, De Officiis I.24"
"You allow tenants to organize and present grievances collectively, even though their collective bargaining power will force you to make concessions you would not make to individuals.","You forbid collective petitions — individual meetings allow you to address each case on its merits, collective action leads to unreasonable demands, the troublemakers hide behind the group, and you can be more generous one-on-one than you can when an organized group is making demands.",justice,"Aquinas, ST II-II Q.58 a.7"
