scenario_a,scenario_b,virtue,source
"You instruct your heirs to pay all outstanding debts before dividing the estate, even though the debts are significant and your heirs will inherit far less.","You tell your heirs to keep quiet about the debts — the creditors may not come forward, your family needs the money more, the debts were to wealthy institutions that will not miss it, and your children's future matters more than old obligations.",justice,"Aquinas, ST II-II Q.62 a.1"
"You discipline your favored student for cheating exactly as you would any other, even though she is your best pupil and the scholarship she will lose was her only path to further education.","You overlook it — she is your best student, one mistake should not define her future, the scholarship is irreplaceable, the cheating was minor, and strict enforcement of rules sometimes produces greater injustice than the violation itself.",justice,"Aquinas, ST II-II Q.63 a.1"
"You pay fair market prices for requisitioned food, even though your army has the power to simply take it and the farmers cannot refuse.","You take what you need without payment — your army is fighting to protect these farmers, requisition is a standard wartime practice, the farmers will recover, and the war fund has better uses than compensating people who would be overrun without your protection.",justice,"Augustine, City of God I.7"
"You expel the cheating member after a fair hearing, even though he is your largest financial contributor and his departure will strain the guild's budget.","You cover it up — his contributions fund the guild's charitable work, the customers he cheated are few and can be quietly compensated, expulsion would trigger a lawsuit, and one member's indiscretion does not justify destroying the guild's finances.",justice,"Aquinas, ST II-II Q.77 a.1"
"You vote against the project that would benefit your own property, knowing your neighbors and family will be angry that you voted against your own financial interest.","You vote for the project — your property value will increase, the harm to other neighborhoods is speculative, you can use the profits to do good works, and voting against your own interest is noble-sounding but foolish.",justice,"Aquinas, ST II-II Q.58 a.7"
"You treat injured travelers regardless of their religion, even though your community disapproves and some monks refuse to assist.","You treat only those who share your beliefs — your community's donations fund the hospital, your monks' religious convictions must be respected, the travelers have their own institutions, and forcing monks to serve outsiders violates their conscience.",justice,"Ambrose, De Officiis I.30"
"You send relief supplies to all flood-affected areas including those that opposed you politically, even though your supporters expect you to reward loyalty and punish opposition.","You prioritize areas that supported you — resources are limited, your supporters sacrificed for you, the opposition chose their side, and sending aid to your enemies demoralizes the people who put you in power.",justice,"Augustine, City of God XIX.15"
"You grant your servant a day of rest each week, even though it reduces the household's productivity and your peers say you are spoiling the help.","You work the servant every day — there is always work to be done, servants in other households work daily, rest makes them lazy, and a day off is a luxury neither of you can afford.",justice,"Ambrose, De Officiis I.28"
"You fulfill your pledge to fund the orphan school despite your investment losses, scaling back your own lifestyle significantly.","You withdraw the funding — circumstances have changed, the investment losses were unforeseeable, your own family must come first, and the orphans will find another benefactor.",justice,"Aquinas, ST II-II Q.62 a.1"
"You require the support fund to cover all members' families equally, including journeymen, even though masters pay higher dues and resent equal treatment.","You reserve the fund for masters' families — masters pay the most dues, journeymen are transient, masters have deeper roots in the community, and differential benefits reflect differential contributions.",justice,"Aquinas, ST II-II Q.61 a.2"
"You admit your unjust order to your troops and reverse it, even though the admission damages your authority and your officers say a commander should never admit error.","You insist the order be carried out — reversing it destroys discipline, admitting error emboldens soldiers to question future orders, the consequences are manageable, and a commander's authority depends on consistency.",justice,"Augustine, City of God V.18"
"You sell your personal silverware to buy food for refugees, leaving yourself with nothing of value.","You keep your silver — the refugees are the government's responsibility, your personal property is not public funds, selling everything to feed strangers leaves you destitute, and impoverishing yourself helps no one in the long run.",justice,"Ambrose, De Officiis II.28"
"You adjust chores to each child's age and strength, even though the older children complain the younger ones have it too easy.","You give the youngest the heaviest chores — it builds character, the older children earned lighter duties through years of service, the youngest needs to learn that life is not fair, and the older children's complaints are legitimate.",justice,"Aquinas, ST II-II Q.63 a.4"
"You forgive the debt of your impoverished neighbor, absorbing a loss that strains your own finances.","You demand full repayment — a debt is a contract, forgiveness encourages others to borrow without intending to repay, your own family has needs, and selling the neighbor's home is unfortunate but legally and morally justified.",justice,"Ambrose, De Nabuthe 5"
"You appoint a guardian for the minor children, even though it slows the proceedings and the adults involved want to settle quickly.","You let the dispute proceed without representation for the children — the adults involved will look after the children's interests, appointing a guardian adds expense and delay, and the children are too young to know the difference.",justice,"Aquinas, ST II-II Q.62 a.5"
"You ensure humane prison conditions — clean water, adequate food, protection — even though the public says criminals deserve suffering and the budget could be used for law-abiding citizens.","You build the prison as cheaply as possible — the funds saved go to schools and hospitals for the innocent, criminals chose their fate, harsh conditions deter crime, and taxpayers should not pay for the comfort of those who harmed them.",justice,"Augustine, City of God XIX.6"
"You compensate the poorest villagers when you enclose common lands, even though it reduces your profit from the enclosure significantly.","You enclose the commons without compensation — the land is legally yours, the villagers had only customary access not legal rights, your improvements will create jobs, and progress always has costs.",justice,"Ambrose, De Nabuthe 3"
"You give your adopted child equal inheritance rights, even though your natural children object and the law does not require it.","You reserve the inheritance for your natural children — blood is blood, the adopted child has been provided for, your natural children expected the full estate, and dividing it further harms the family's wealth.",justice,"Aquinas, ST II-II Q.57 a.4"
"You ensure local courts operate independently from your personal influence, even when cases touch your interests and your advisors say you are being naive.","You influence the courts when your interests are at stake — you are the prince, justice should serve the realm's stability, your interests align with the province's interests, and an independent court might rule against policies that benefit everyone.",justice,"Aquinas, ST II-II Q.60 a.6"
"You grant sanctuary to the fugitive until his case can be heard, even though the local lord threatens retaliation against the monastery.","You hand the fugitive over — the lord's anger is dangerous, the fugitive is probably guilty, harboring him makes you an accomplice, and the monastery's survival serves more people than one fugitive's rights.",justice,"Ambrose, De Officiis I.24"
"You pay local taxes and tariffs honestly, even though other foreign merchants evade them and undercut your prices.","You smuggle goods to avoid the taxes — every other foreign merchant does it, the tariffs are unfairly high for outsiders, the local officials expect it and look the other way, and the extra profit is the only way to compete.",justice,"Aquinas, ST II-II Q.66 a.5"
"You award the scholarship to the most qualified applicant, even though the benefactor's nephew also applied and the benefactor will likely end future donations.","You give the scholarship to the nephew — the difference in qualification is small, the benefactor's continued support funds many more scholarships, and alienating him over one award is poor stewardship of a long-term relationship.",justice,"Aquinas, ST II-II Q.63 a.1"
"You settle the wage dispute based on comparable market rates, ruling against the party that offered you a private consideration.","You rule in favor of the party who offered private consideration — the rates are genuinely ambiguous, someone has to lose, the consideration compensates you fairly for your time, and the outcome is within the range of reasonable rulings.",justice,"Aquinas, ST II-II Q.77 a.1"
"You provide advocates at public expense for accused persons who cannot afford defense, straining an already thin court budget.","You proceed without defense for the poor accused — the budget cannot support it, most are clearly guilty, the court process itself is fair, and the prosecution presents the facts that matter.",justice,"Ambrose, De Officiis I.24"
"You instruct that church property be returned to the community rather than given to your relatives, even though your family is not wealthy and could use the help.","You bequeath the property to your relatives — you served the church faithfully for decades, your family sacrificed while you gave your life to service, the property is modest, and providing for your family after a lifetime of service is not greed but justice.",justice,"Ambrose, De Officiis II.28"
"You keep precise records available for inspection, even though transparency reveals some expenditures that could be questioned.","You keep records vague — detailed records invite second-guessing of every decision, some expenditures are easier to explain in person, the estate runs well and that should be proof enough, and excessive transparency ties your hands.",justice,"Aquinas, ST II-II Q.62 a.5"
"You negotiate treaties that genuinely serve the kingdom's interests rather than your own, even though no one will know the difference until the king is old enough to review them.","You negotiate terms that benefit yourself — the king will never know which provisions were for the kingdom and which for you, your service deserves compensation, and the treaties are good enough for the kingdom regardless.",justice,"Augustine, City of God V.19"
"You ensure the criminal's innocent family keeps their property and dignity, even though the public wants them to suffer and your advisors say mercy for the family looks like mercy for the crime.","You seize the family's property — the criminal's assets should compensate his victims, the family benefited from his crimes, confiscation deters future criminals' families from enabling crime, and the public expects visible consequences.",justice,"Aquinas, ST II-II Q.108 a.4"
"You impose the same regulations on local and foreign merchants, even though local merchants funded your campaign and expect protection.","You impose heavier regulations on foreign merchants — protecting local businesses protects local jobs, foreign merchants send profits abroad, your constituents expect you to look after their interests, and every successful trading city protects its own.",justice,"Aquinas, ST II-II Q.77 a.1"
"You ensure tenant farmers receive fair leases and are not evicted without cause, even though higher rents would fund improvements to the cathedral.","You raise rents to fund the cathedral — a magnificent cathedral glorifies God and draws pilgrims who benefit the entire region, the farmers can find other land, and investing in the church's beauty is investing in the community's soul.",justice,"Ambrose, De Nabuthe 1"
"You ask your eldest son to treat his siblings as equals, even though giving him authority would simplify household management after your death.","You give your eldest full authority — someone must lead, the youngest need guidance, equal authority means no authority, and the eldest has the maturity and experience to govern the household wisely.",justice,"Aquinas, ST II-II Q.57 a.4"
"You pass a law that applies equally to council members, even though your fellow councilmen threaten to block your other legislation in retaliation.","You include an exemption for council members — council work is uniquely demanding, the exemption is narrow and reasonable, your other legislation is more important, and antagonizing your colleagues over a symbolic point is politically foolish.",justice,"Aquinas, ST II-II Q.96 a.5"
"You pay subcontractors promptly as agreed, even though delaying payment would help your cash flow and they cannot easily seek recourse.","You delay payment — your cash flow needs take priority, the subcontractors have other income, everyone in the industry delays payment, and you will pay eventually. Using other people's money to manage your finances is standard business practice.",justice,"Aquinas, ST II-II Q.61 a.1"
"You restructure the bridge toll to be equitable, even though the current structure generates more revenue.","You keep the regressive toll — it raises more revenue for infrastructure that benefits everyone, restructuring creates administrative costs, and travelers can choose to ford the river if they find the toll unfair.",justice,"Ambrose, De Nabuthe 1"
"You maintain free access to the well on your property, even though fencing it and charging would be profitable and is legally within your rights.","You fence the well and charge — it is your property, maintenance costs money, free access means no one maintains it, and a market price ensures the well is properly cared for.",justice,"Ambrose, De Nabuthe 3"
"You select the more skilled candidate for the apprenticeship despite the other being your nephew, knowing your sister will be furious.","You select your nephew — the candidates are close in ability, family loyalty is a virtue, your nephew will work harder to prove himself, and your sister has sacrificed to raise the boy for this opportunity.",justice,"Aquinas, ST II-II Q.63 a.1"
"You give priests fair hearings before disciplinary action, even when public pressure for swift action threatens your own position.","You remove priests without hearings when pressure mounts — public confidence requires swift action, the evidence is usually clear, lengthy hearings look like coverups, and your primary duty is to the institution's reputation.",justice,"Ambrose, De Officiis I.24"
"You honor the original agreed price even though the goods are now scarce and you could charge much more.","You demand the higher market price — the market has changed, the original agreement did not account for scarcity, you could sell to someone else for more, and honoring an outdated price punishes you for the other party's good luck.",justice,"Aquinas, ST II-II Q.77 a.1"
"You provide equal council representation for all districts regardless of wealth, even though wealthy districts contribute most of the tax base and demand proportional voice.","You allocate seats by tax contribution — those who fund the government deserve proportional voice, wealthy districts bring expertise, equal representation lets low-contributing districts overrule those who bear the costs, and representation without taxation is parasitism.",justice,"Augustine, City of God XIX.21"
